,url_doc,wants_help,name,is_github,description,github_org,url,date,doc_issues
22,https://github.com/deeplearning4j/deeplearning4j/projects/1,Yes,Deeplearning4j,yes,"Deeplearning4j is the first commercial-grade, open-source, distributed deep-learning library written for Java and Scala. Integrated with Hadoop and Spark, DL4J is designed to be used in business environments on distributed GPUs and CPUs.",deeplearning4j/deeplearning4j,https://deeplearning4j.org/,3/2/2017 10:43:29,"[{'url': 'https://github.com/deeplearning4j/deeplearning4j/issues/2875', 'title': 'Styled Icon for warnings or notes'}, {'url': 'https://github.com/deeplearning4j/deeplearning4j/issues/2858', 'title': 'Create a normalization page'}, {'url': 'https://github.com/deeplearning4j/deeplearning4j/issues/2831', 'title': 'Documentation is not in detail for KmeansClustering'}, {'url': 'https://github.com/deeplearning4j/deeplearning4j/issues/2807', 'title': 'Ensure all deprecated methods have appropriate javadoc'}, {'url': 'https://github.com/deeplearning4j/deeplearning4j/issues/2777', 'title': 'RNN simple example and documentation improvement'}, {'url': 'https://github.com/deeplearning4j/deeplearning4j/issues/2772', 'title': 'Allow pre-tokenized text with Word2Vec/ParagraphVectors'}, {'url': 'https://github.com/deeplearning4j/deeplearning4j/issues/2770', 'title': 'Documentation for ParagraphVectors learning rate'}, {'url': 'https://github.com/deeplearning4j/deeplearning4j/issues/2769', 'title': 'Documentation for ParagraphVectors learning algorithms'}, {'url': 'https://github.com/deeplearning4j/deeplearning4j/issues/2752', 'title': 'ModelImport Documentation summary and input'}, {'url': 'https://github.com/deeplearning4j/deeplearning4j/issues/2744', 'title': 'Broken link in the doc'}, {'url': 'https://github.com/deeplearning4j/deeplearning4j/issues/2734', 'title': 'Build WebApp for VGG model inference'}, {'url': 'https://github.com/deeplearning4j/deeplearning4j/issues/2732', 'title': 'Examples: Update SDA Examples'}, {'url': 'https://github.com/deeplearning4j/deeplearning4j/issues/2725', 'title': 'Find and link example from Peter Lin @woolfel'}, {'url': 'https://github.com/deeplearning4j/deeplearning4j/issues/2724', 'title': 'Spark Requirements missing on WIndows - Hint in the Quickstart-Guide'}, {'url': 'https://github.com/deeplearning4j/deeplearning4j/issues/2722', 'title': 'Code quality: Example - Using @Deprecated with comments and Javadoc links'}, {'url': 'https://github.com/deeplearning4j/deeplearning4j/issues/2708', 'title': 'JNI/JavaCPP/NativeOps explanation'}, {'url': 'https://github.com/deeplearning4j/deeplearning4j/issues/2701', 'title': 'Rework NLP section of weddocs'}, {'url': 'https://github.com/deeplearning4j/deeplearning4j/issues/2671', 'title': 'Document learning rate schedules'}, {'url': 'https://github.com/deeplearning4j/deeplearning4j/issues/2487', 'title': 'Request for update documentation in org.deeplearning4j.text.documentiterator'}, {'url': 'https://github.com/deeplearning4j/deeplearning4j/issues/2451', 'title': 'Refactor Website Documentation'}, {'url': 'https://github.com/deeplearning4j/deeplearning4j/issues/2323', 'title': 'Page not found'}, {'url': 'https://github.com/deeplearning4j/deeplearning4j/issues/2283', 'title': 'update tutorials & documentation to new 8.0 version of NVIDIA toolkit'}, {'url': 'https://github.com/deeplearning4j/deeplearning4j/issues/2157', 'title': 'Website: add simple database of resources'}, {'url': 'https://github.com/deeplearning4j/deeplearning4j/issues/2945', 'title': 'Update on-site documentation'}, {'url': 'https://github.com/deeplearning4j/deeplearning4j/issues/1678', 'title': 'Thread safety'}, {'url': 'https://github.com/deeplearning4j/deeplearning4j/issues/1675', 'title': 'Document: how to get optimal (computational) performance out of DL4J/ND4J'}, {'url': 'https://github.com/deeplearning4j/deeplearning4j/issues/1512', 'title': '[Docs + javadoc] document different for nIn between feedforward and convolutional layers'}, {'url': 'https://github.com/deeplearning4j/deeplearning4j/issues/1502', 'title': 'Describe concat better'}, {'url': 'https://github.com/deeplearning4j/deeplearning4j/issues/1494', 'title': 'Document LearningRatePolicy'}, {'url': 'https://github.com/deeplearning4j/deeplearning4j/issues/1485', 'title': 'Clarifying the documentation on ""importing a time series"" for RNN networks. '}, {'url': 'https://github.com/deeplearning4j/deeplearning4j/issues/1483', 'title': '[Docs] Document how to use Evaluation and RegressionEvaluation classes'}, {'url': 'https://github.com/deeplearning4j/deeplearning4j/issues/2941', 'title': 'Dev guide: document intellij quirks'}, {'url': 'https://github.com/deeplearning4j/deeplearning4j/issues/1390', 'title': 'Improve troubleshooting docs'}, {'url': 'https://github.com/deeplearning4j/deeplearning4j/issues/1206', 'title': 'Docs: Clarify labels/classes handling for image loading'}, {'url': 'https://github.com/deeplearning4j/deeplearning4j/issues/1082', 'title': 'Wrong DeepAutoEncoder example in documentation'}, {'url': 'https://github.com/deeplearning4j/deeplearning4j/issues/1068', 'title': 'Review parameter initialization for RBMs/DBNs'}, {'url': 'https://github.com/deeplearning4j/deeplearning4j/issues/925', 'title': 'Please provide an example of LSTM Network for Anomaly Detection'}, {'url': 'https://github.com/deeplearning4j/deeplearning4j/issues/909', 'title': 'Java docs should mention whether Nd4j operation creates a new copy or not'}, {'url': 'https://github.com/deeplearning4j/deeplearning4j/issues/870', 'title': 'Documentation: Details on parameter tuning,weight initialization, etc'}, {'url': 'https://github.com/deeplearning4j/deeplearning4j/issues/2934', 'title': 'Build Lucene index over javadoc, examples, and other resources'}, {'url': 'https://github.com/deeplearning4j/deeplearning4j/issues/2914', 'title': 'Comparing frameworks documentation issue for TensorFlow'}]"
23,,Yes,Henson,yes,cooperative multi-tasking for in situ processing,mrzv/henson,http://github.org/mrzv/henson,3/2/2017 12:56:21,
24,,Yes,DIY,yes,block-parallel data analysis library,diatomic/diy,https://diatomic.github.io/diy/,3/2/2017 12:57:31,
25,,No,Dionysus,no,library for computing persistent homology,,http://bids.github.io/docathon,3/2/2017 12:58:41,
26,,Yes,SNCosmo,yes,Python library for supernova cosmology,sncosmo/sncosmo,http://sncosmo.readthedocs.io,3/2/2017 16:21:28,
27,https://github.com/librariesio/documentation/projects/1,Yes,Libraries.io,yes,"Libraries.io indexes over 2 million unique, open source projects from 33 package mangers (and growing) to help you make more informed decisions about the software you use. ",librariesio/libraries.io,http://docs.libraries.io,3/3/2017 1:44:03,"[{'url': 'https://github.com/librariesio/libraries.io/issues/1034', 'title': 'Add Crystal docs links'}, {'url': 'https://github.com/librariesio/libraries.io/issues/1031', 'title': 'Document how to add support for a new package manager'}, {'url': 'https://github.com/librariesio/libraries.io/issues/983', 'title': 'Document the dependency tree API endpoint'}, {'url': 'https://github.com/librariesio/libraries.io/issues/198', 'title': 'API Documentation '}, {'url': 'https://github.com/librariesio/libraries.io/issues/1250', 'title': ""Add 'roadmap' to documentation""}, {'url': 'https://github.com/librariesio/libraries.io/issues/31', 'title': 'Pull in/generate documentation for projects'}, {'url': 'https://github.com/librariesio/libraries.io/issues/1214', 'title': 'Add feature to request for more than one package from the api'}, {'url': 'https://github.com/librariesio/libraries.io/issues/1249', 'title': 'Add infrastrucutre to documentation'}, {'url': 'https://github.com/librariesio/libraries.io/issues/1245', 'title': 'API docs: http status codes '}]"
28,"(not currently, but I can work on a list this weekend)",Yes,Galaxy,yes,"Galaxy is an open, web-based platform for data intensive biomedical research.",galaxyproject/galaxy,"http://docs.galaxyproject.org, new.galaxyproject.org",3/3/2017 10:44:57,"[{'url': 'https://github.com/galaxyproject/galaxy/issues/3563', 'title': 'https://galaxy.readthedocs.io is still online but not updated'}, {'url': 'https://github.com/galaxyproject/galaxy/issues/3667', 'title': 'typo in tool syntax doc'}]"
29,,Yes,Julia,yes,"Julia is a high-level, high-performance, dynamic programming language for technical computing. It provides a sophisticated compiler, distributed parallel execution, numerical accuracy, and an extensive mathematical function library. Julia’s Base library, largely written in Julia itself, also integrates mature, best-of-breed open source C and Fortran libraries for linear algebra, random number generation, signal processing, and string processing. In addition, the Julia developer community is contributing a number of external packages through Julia’s built-in package manager at a rapid pace. IJulia, a collaboration between the Jupyter and Julia communities, provides a powerful browser-based graphical notebook interface to Julia.",JuliaLang/julia,http://docs.julialang.org,3/3/2017 17:10:13,"[{'url': 'https://github.com/JuliaLang/julia/issues/19917', 'title': 'zip as its own inverse'}, {'url': 'https://github.com/JuliaLang/julia/issues/19857', 'title': ""svds documentation doesn't explain how to extract factors""}, {'url': 'https://github.com/JuliaLang/julia/issues/20813', 'title': 'DOC: Memory layout - list of dead terms/links @ Manual'}, {'url': 'https://github.com/JuliaLang/julia/issues/19767', 'title': 'Document BitVector shift methods'}, {'url': 'https://github.com/JuliaLang/julia/issues/19579', 'title': 'DOC: Rewrite manual for parallel '}, {'url': 'https://github.com/JuliaLang/julia/issues/19286', 'title': 'Manual: ""Running External Programs"" does not explain how to change working directory'}, {'url': 'https://github.com/JuliaLang/julia/issues/20788', 'title': 'document that shift operators on BitVectors accept negative shifts'}, {'url': 'https://github.com/JuliaLang/julia/issues/18841', 'title': 'Improve docs about documenting Julia'}, {'url': 'https://github.com/JuliaLang/julia/issues/18834', 'title': ""`writeall` referenced in docs, but doesn't exist""}, {'url': 'https://github.com/JuliaLang/julia/issues/18685', 'title': 'Profile.print(cols=500) error'}, {'url': 'https://github.com/JuliaLang/julia/issues/18656', 'title': 'Documentation: ""Noteworthy Differences from other Languages"" -- outdated information + minor mistakes'}, {'url': 'https://github.com/JuliaLang/julia/issues/18423', 'title': 'Provide method for `sum` that accepts a neutral element'}, {'url': 'https://github.com/JuliaLang/julia/issues/18004', 'title': 'show(io, x) vs show(io, ""text/plain"", x) -- docs?'}, {'url': 'https://github.com/JuliaLang/julia/issues/16821', 'title': 'the documentation on readavailable still makes it sounds like you might actually want to use this function'}, {'url': 'https://github.com/JuliaLang/julia/issues/16742', 'title': 'Filter is not documented'}, {'url': 'https://github.com/JuliaLang/julia/issues/15693', 'title': 'document io and trailing args for print/ln'}, {'url': 'https://github.com/JuliaLang/julia/issues/14962', 'title': 'Function documentation ignored when placed under conditional'}, {'url': 'https://github.com/JuliaLang/julia/issues/14944', 'title': 'Pkg.publish before tagging a version.'}, {'url': 'https://github.com/JuliaLang/julia/issues/14821', 'title': 'Document performance problem (and work-around) for arithmetic operations with many arguments'}, {'url': 'https://github.com/JuliaLang/julia/issues/14052', 'title': 'Julep: extended proposal for fixing show, print, & friends'}, {'url': 'https://github.com/JuliaLang/julia/issues/20904', 'title': 'Function help within REPL hangs, then produces 6357 lines of output.'}, {'url': 'https://github.com/JuliaLang/julia/issues/10667', 'title': 'REPL integrated readline'}, {'url': 'https://github.com/JuliaLang/julia/issues/10443', 'title': 'Add a word in the manual about performance of keyword arguments'}, {'url': 'https://github.com/JuliaLang/julia/issues/9498', 'title': 'Keyword arguments affect methods dispatch'}, {'url': 'https://github.com/JuliaLang/julia/issues/20740', 'title': 'Wishlist: documentation for extending broadcast'}, {'url': 'https://github.com/JuliaLang/julia/issues/9318', 'title': 'SIMD vectorization of SubArrays and Complex numbers'}, {'url': 'https://github.com/JuliaLang/julia/issues/8191', 'title': 'Document assignment syntax'}, {'url': 'https://github.com/JuliaLang/julia/issues/7706', 'title': 'Document goto in manual'}, {'url': 'https://github.com/JuliaLang/julia/issues/7535', 'title': 'improve BigFloat documentation'}, {'url': 'https://github.com/JuliaLang/julia/issues/7437', 'title': 'Small contradiction in Packages doc'}, {'url': 'https://github.com/JuliaLang/julia/issues/5709', 'title': 'Show, showcompact, showall, showlimited, print, repr, summary, and friends'}, {'url': 'https://github.com/JuliaLang/julia/issues/5509', 'title': 'More hyperlinks'}, {'url': 'https://github.com/JuliaLang/julia/issues/5010', 'title': 'Add Troubleshooting section to manual'}, {'url': 'https://github.com/JuliaLang/julia/issues/20707', 'title': 'document `rem(x,T)` / `x % T` for `T` a type'}, {'url': 'https://github.com/JuliaLang/julia/issues/20617', 'title': 'listen(tempname()) fails on Windows'}, {'url': 'https://github.com/JuliaLang/julia/issues/20602', 'title': 'Add sub-headings in table of contents of PDF documentation'}, {'url': 'https://github.com/JuliaLang/julia/issues/20539', 'title': 'conv corner case'}, {'url': 'https://github.com/JuliaLang/julia/issues/20877', 'title': 'Manual describes deprecated inner constructor syntax'}, {'url': 'https://github.com/JuliaLang/julia/issues/20870', 'title': 'Edit link in HTML docs'}, {'url': 'https://github.com/JuliaLang/julia/issues/20375', 'title': ""joinpath() doesn't add path separator between drive and directory ""}, {'url': 'https://github.com/JuliaLang/julia/issues/20363', 'title': ""Can't search for a function with a bang in the HTML docs""}, {'url': 'https://github.com/JuliaLang/julia/issues/20355', 'title': ""results for negative y in mod1(x,y) doesn't agree with documentation""}, {'url': 'https://github.com/JuliaLang/julia/issues/20353', 'title': 'Add FAQ with correct solution(s) for ""static"" variables in functions'}, {'url': 'https://github.com/JuliaLang/julia/issues/20325', 'title': 'Manual for networking and streams could be better'}, {'url': 'https://github.com/JuliaLang/julia/issues/20915', 'title': 'Use of ÷ in the manual'}, {'url': 'https://github.com/JuliaLang/julia/issues/20296', 'title': 'Weird manual example of inner/outer constructor. '}, {'url': 'https://github.com/JuliaLang/julia/issues/20087', 'title': 'Bug when documenting object overloading'}, {'url': 'https://github.com/JuliaLang/julia/issues/20064', 'title': 'Some docstrings always show up (but they should not)'}, {'url': 'https://github.com/JuliaLang/julia/issues/20020', 'title': 'Pkg.build has silent failure when exit() used within build.jl'}, {'url': 'https://github.com/JuliaLang/julia/issues/20004', 'title': 'isposdef() is incorrect'}, {'url': 'https://github.com/JuliaLang/julia/issues/20828', 'title': 'Still unable to search for macros in the doc'}, {'url': 'https://github.com/JuliaLang/julia/issues/19988', 'title': 'Document JULIA_* environment variables'}, {'url': 'https://github.com/JuliaLang/julia/issues/19945', 'title': 'Document/export copy-free string allocation?'}]"
30,,Yes,pulse2percept,yes,Pulse2percept is a Python library for bionic vision. It features a computational model that has the goal of predicting the perceptual experience of retinal prosthesis patients. The model takes as input a series of (simulated) electrical pulse trains---one pulse train per electrode in the array---and converts them into an image sequence that corresponds to the predicted perceptual experience of a patient.,uwescience/pulse2percept,https://uwescience.github.io/pulse2percept/,3/3/2017 18:36:25,
31,,Yes,watchtower,yes,"Watchtower is a package for scraping activity on Github (both users and projects) and storing it for later analysis. It's still in a very alpha version, but is what is powering the stats pages used by the Docathon.",NelleV/watchtower,https://github.com/NelleV/watchtower,3/4/2017 11:59:52,
32,https://github.com/UCI-CARL/CARLsim3/projects/1,Yes,CARLsim3,yes,"CARLsim is an efficient, easy-to-use, GPU-accelerated library for simulating large-scale spiking neural network (SNN) models with a high degree of biological detail. CARLsim allows execution of networks of Izhikevich spiking neurons with realistic synaptic dynamics on both generic x86 CPUs and standard off-the-shelf GPUs. The simulator provides a PyNN-like programming interface in C/C++, which allows for details and parameters to be specified at the synapse, neuron, and network level.",UCI-CARL/CARLsim3,https://uci-carl.github.io/CARLsim3,3/4/2017 20:33:19,"[{'url': 'https://github.com/UCI-CARL/CARLsim3/issues/15', 'title': 'User Guide Chapter 1: Update installation instructions for GitHub'}, {'url': 'https://github.com/UCI-CARL/CARLsim3/issues/6', 'title': 'Complete CARLsim API documentation'}, {'url': 'https://github.com/UCI-CARL/CARLsim3/issues/5', 'title': 'Document PrePostGroupSpikeGen'}, {'url': 'https://github.com/UCI-CARL/CARLsim3/issues/4', 'title': 'Document InteractiveSpikeGen'}, {'url': 'https://github.com/UCI-CARL/CARLsim3/issues/3', 'title': 'Improve User Guide Chapter 11'}, {'url': 'https://github.com/UCI-CARL/CARLsim3/issues/2', 'title': 'Add a Tutorial that shows off spatial connectivity pattern'}, {'url': 'https://github.com/UCI-CARL/CARLsim3/issues/1', 'title': 'User Guide, Chapter 10: ECJ installation info is out of date'}, {'url': 'https://github.com/UCI-CARL/CARLsim3/issues/13', 'title': 'User Guide: Better explain how to set up STDP'}, {'url': 'https://github.com/UCI-CARL/CARLsim3/issues/12', 'title': 'User Guide Chapter 1: Tell users to install CUDA samples'}, {'url': 'https://github.com/UCI-CARL/CARLsim3/issues/11', 'title': 'Add a Tutorial that shows off multi-compartment models'}, {'url': 'https://github.com/UCI-CARL/CARLsim3/issues/10', 'title': 'User Guide Chapter 5: Document DA-STDP'}, {'url': 'https://github.com/UCI-CARL/CARLsim3/issues/9', 'title': 'Document ConnectionReader (OAT)'}, {'url': 'https://github.com/UCI-CARL/CARLsim3/issues/8', 'title': 'Add Motion Energy tutorial'}, {'url': 'https://github.com/UCI-CARL/CARLsim3/issues/7', 'title': 'Fix Doxygen issues on Windows'}]"
33,https://github.com/UCI-CARL/CARLsim4/projects/1,Yes,carlsim4,yes,"CARLsim is an efficient, easy-to-use, GPU-accelerated software framework for simulating large-scale spiking neural network (SNN) models with a high degree of biological detail. ",UCI-CARL/CARLsim4,http://uci-carl.github.io/CARLsim4,3/5/2017 16:38:05,"[{'url': 'https://github.com/UCI-CARL/CARLsim4/issues/6', 'title': 'Add continuous integration'}, {'url': 'https://github.com/UCI-CARL/CARLsim4/issues/5', 'title': 'Update installation instructions'}]"
34,https://github.com/sunpy/sunpy/projects/4,Yes,sunpy,yes,"SunPy is a community-developed free and open-source software package for solar physics. SunPy is meant to be a free alternative to the SolarSoft data analysis environment which is based on the IDL scientific programming language sold by Exelis. Though SolarSoft is open-source IDL is not and can be prohibitively expensive. The aim of the SunPy project is to provide the software tools necessary so that anyone can analyze solar data. SunPy is written using the Python programming language and is build upon the scientific Python environment which includes the core packages NumPy, SciPy. The development of SunPy is associated with that of Astropy. SunPy was founded on March 28, 2011 by a small group of scientists and developers at the NASA Goddard Space Flight Center. Thanks to the generous support of the ESA Summer of Code and the Google Summer of Code as well as contributors from around the world, SunPy is now a global project and is not associated with any individual institution. ",sunpy/sunpy,http://docs.sunpy.org/,3/6/2017 1:27:06,"[{'url': 'https://github.com/sunpy/sunpy/issues/1704', 'title': 'Install documentation should suggest a Python version'}, {'url': 'https://github.com/sunpy/sunpy/issues/1177', 'title': 'Fix doctests and enable them on Travis'}, {'url': 'https://github.com/sunpy/sunpy/issues/1960', 'title': 'RTD docs missing links to generated indices'}, {'url': 'https://github.com/sunpy/sunpy/issues/1959', 'title': 'sunpy fails documented self-test procedure'}]"
